----------------------------------------------------------------------------
CrystalDiskInfo 9.6.3 (C) 2008-2024 hiyohiyo
                                Crystal Dew World: https://crystalmark.info/
----------------------------------------------------------------------------

    OS : Windows Server 2016 1607 [10.0 Build 14393] (x64)
  Date : 2025/04/21 23:04:17

-- Controller Map ----------------------------------------------------------
 - Microsoft Storage Spaces Controller [SCSI]
 - Microsoft VHD Loopback Controller [SCSI]
 + Intel(R) Desktop/Workstation/Server Express Chipset SATA RAID Controller [SCSI]
   - ST1000DM010-2EP102
   - WDC WD20EZAZ-00GGJB0
   - WDC WD20EZAZ-00GGJB0
   - Samsung SSD 860 EVO 1TB

-- Disk List ---------------------------------------------------------------
 (01) ST1000DM010-2EP102 : 1000.2 GB [0/0/0, pd1]
 (02) WDC WD20EZAZ-00GGJB0 : 2000.3 GB [1/0/0, pd1]
 (03) WDC WD20EZAZ-00GGJB0 : 2000.3 GB [2/0/0, pd1]
 (04) WDC WD40NMZW-59GX6S1 : 4000.7 GB [4/0/0, sa1]
 (05) WDC WD40NMZW-59GX6S1 : 4000.7 GB [5/0/0, sa1]
 (06) Samsung SSD 860 EVO 1TB : 1000.2 GB [3/0/0, pd1] - sg

----------------------------------------------------------------------------
 (01) ST1000DM010-2EP102
----------------------------------------------------------------------------
           Model : ST1000DM010-2EP102
        Firmware : CC45
   Serial Number : ZN1ANQFR
       Disk Size : 1000.2 GB (8.4/137.4/1000.2/----)
     Buffer Size : Unknown
     Queue Depth : 32
    # of Sectors : 1953525168
   Rotation Rate : 7200 RPM
       Interface : Serial ATA
   Major Version : ATA8-ACS
   Minor Version : ATA8-ACS version 4
   Transfer Mode : SATA/600 | SATA/600
  Power On Hours : 42635 hours
  Power On Count : 49 count
     Temperature : 32 C (89 F)
   Health Status : Good
        Features : S.M.A.R.T., APM, NCQ, GPL
       APM Level : 8080h [ON]
       AAM Level : ----
    Drive Letter : C:

-- S.M.A.R.T. --------------------------------------------------------------
ID Cur Wor Thr RawValues(6) Attribute Name
01 _82 _63 __6 00000AE8AF97 Read Error Rate
03 _97 _97 __0 000000000000 Spin-Up Time
04 100 100 _20 000000000035 Start/Stop Count
05 100 100 _10 000000000000 Reallocated Sectors Count
07 _88 _60 _45 000029F7AD2B Seek Error Rate
09 _52 _52 __0 00000000A68B Power-On Hours
0A 100 100 _97 000000000000 Spin Retry Count
0C 100 100 _20 000000000031 Power Cycle Count
B7 100 100 __0 000000000000 Vendor Specific
B8 100 100 _99 000000000000 End-to-End Error
BB 100 100 __0 000000000000 Reported Uncorrectable Errors
BC 100 100 __0 000000000000 Command Timeout
BD 100 100 __0 000000000000 High Fly Writes
BE _68 _55 _40 0000251E0020 Airflow Temperature
C1 100 100 __0 00000000071D Load/Unload Cycle Count
C2 _32 _16 __0 001000000020 Temperature
C3 __1 __1 __0 00000AE8AF97 Hardware ECC recovered
C5 100 100 __0 000000000000 Current Pending Sector Count
C6 100 100 __0 000000000000 Uncorrectable Sector Count
C7 200 200 __0 000000000000 UltraDMA CRC Error Count
F0 100 253 __0 F0AA0000A649 Head Flying Hours
F1 100 253 __0 0014F59F9D95 Total Host Writes
F2 100 253 __0 000D9B85353E Total Host Reads

-- IDENTIFY_DEVICE ---------------------------------------------------------
        0    1    2    3    4    5    6    7    8    9
000: 0C5A 3FFF C837 0010 0000 0000 003F 0000 0000 0000
010: 2020 2020 2020 2020 2020 2020 5A4E 3141 4E51 4652
020: 0000 0000 0000 4343 3435 2020 2020 5354 3130 3030
030: 444D 3031 302D 3245 5031 3032 2020 2020 2020 2020
040: 2020 2020 2020 2020 2020 2020 2020 8010 4000 2F00
050: 4000 0200 0200 0007 3FFF 0010 003F FC10 00FB 0010
060: FFFF 0FFF 0000 0007 0003 0078 0078 0078 0078 0000
070: 0000 0000 0000 0000 0000 001F 850E 0006 00CC 004C
080: 01F0 0029 346B 7D69 4163 3449 BC49 4163 407F 003A
090: 003A 8080 FFFE 0000 D0D0 0000 0000 0000 0000 0000
100: 6DB0 7470 0000 0000 0000 0000 6003 0000 5000 C500
110: C353 F24E 0000 0000 0000 0000 0000 0000 0000 401E
120: 401C 0000 0000 0000 0000 0000 0000 0000 0029 6DB0
130: 7470 6DB0 7470 2020 0002 0140 0100 5000 3C06 3C0A
140: 0000 003C 0000 0008 0000 0000 FDFF 0280 0000 0000
150: 0008 0000 0000 0000 0000 8000 0000 0184 9400 8000
160: 0000 0000 0000 0000 0000 0000 0000 0000 0002 0000
170: 0000 0000 0000 0000 0000 0000 0000 0000 0000 0000
180: 0000 0000 0000 0000 0000 0000 0000 0000 0000 0000
190: 0000 0000 0000 0000 0000 0000 0000 0000 0000 0000
200: 0000 0000 0000 0000 0000 0000 1085 0000 0000 4000
210: 0000 0000 0000 0000 0000 0000 0000 1C20 0000 0000
220: 0000 0000 1020 0000 0000 0000 0000 0000 0000 0000
230: 0000 0000 0000 0000 0000 0000 0000 0000 0000 0000
240: 0000 0000 0000 0000 0000 0000 0000 0000 0000 0000
250: 0000 0000 0000 0000 0000 35A5

-- SMART_READ_DATA ---------------------------------------------------------
     +0 +1 +2 +3 +4 +5 +6 +7 +8 +9 +A +B +C +D +E +F
000: 0A 00 01 0F 00 52 3F 97 AF E8 0A 00 00 00 03 03
010: 00 61 61 00 00 00 00 00 00 00 04 32 00 64 64 35
020: 00 00 00 00 00 00 05 33 00 64 64 00 00 00 00 00
030: 00 00 07 0F 00 58 3C 2B AD F7 29 00 00 00 09 32
040: 00 34 34 8B A6 00 00 00 00 00 0A 13 00 64 64 00
050: 00 00 00 00 00 00 0C 32 00 64 64 31 00 00 00 00
060: 00 00 B7 32 00 64 64 00 00 00 00 00 00 00 B8 32
070: 00 64 64 00 00 00 00 00 00 00 BB 32 00 64 64 00
080: 00 00 00 00 00 00 BC 32 00 64 64 00 00 00 00 00
090: 00 00 BD 3A 00 64 64 00 00 00 00 00 00 00 BE 22
0A0: 00 44 37 20 00 1E 25 00 00 00 C1 32 00 64 64 1D
0B0: 07 00 00 00 00 00 C2 22 00 20 10 20 00 00 00 10
0C0: 00 00 C3 1A 00 01 01 97 AF E8 0A 00 00 00 C5 12
0D0: 00 64 64 00 00 00 00 00 00 00 C6 10 00 64 64 00
0E0: 00 00 00 00 00 00 C7 3E 00 C8 C8 00 00 00 00 00
0F0: 00 00 F0 00 00 64 FD 49 A6 00 00 AA F0 27 F1 00
100: 00 64 FD 95 9D 9F F5 14 00 00 F2 00 00 64 FD 3E
110: 35 85 9B 0D 00 00 00 00 00 00 00 00 00 00 00 00
120: 00 00 00 00 00 00 00 00 00 00 00 00 00 00 00 00
130: 00 00 00 00 00 00 00 00 00 00 00 00 00 00 00 00
140: 00 00 00 00 00 00 00 00 00 00 00 00 00 00 00 00
150: 00 00 00 00 00 00 00 00 00 00 00 00 00 00 00 00
160: 00 00 00 00 00 00 00 00 00 00 00 00 00 00 00 73
170: 03 00 01 00 01 73 02 00 00 00 00 00 00 00 00 00
180: 00 00 00 00 42 04 00 00 07 03 03 03 03 03 03 03
190: 03 00 00 00 00 00 00 00 00 01 00 00 00 00 00 00
1A0: 00 00 00 00 00 00 00 00 A6 55 CA D2 98 8B 00 00
1B0: 00 00 00 00 01 00 FF FF 95 9D 9F F5 14 00 00 00
1C0: 3E 35 85 9B 0D 00 00 00 00 00 00 00 16 CD 82 08
1D0: 00 00 00 00 00 00 00 00 44 20 00 00 06 00 00 00
1E0: 00 00 00 00 00 00 00 00 00 00 00 00 00 00 00 05
1F0: 00 00 00 00 00 00 00 00 00 00 14 17 00 00 00 8C

-- SMART_READ_THRESHOLD ----------------------------------------------------
     +0 +1 +2 +3 +4 +5 +6 +7 +8 +9 +A +B +C +D +E +F
000: 01 00 01 06 00 00 00 00 00 00 00 00 00 00 03 00
010: 00 00 00 00 00 00 00 00 00 00 04 14 00 00 00 00
020: 00 00 00 00 00 00 05 0A 00 00 00 00 00 00 00 00
030: 00 00 07 2D 00 00 00 00 00 00 00 00 00 00 09 00
040: 00 00 00 00 00 00 00 00 00 00 0A 61 00 00 00 00
050: 00 00 00 00 00 00 0C 14 00 00 00 00 00 00 00 00
060: 00 00 B7 00 00 00 00 00 00 00 00 00 00 00 B8 63
070: 00 00 00 00 00 00 00 00 00 00 BB 00 00 00 00 00
080: 00 00 00 00 00 00 BC 00 00 00 00 00 00 00 00 00
090: 00 00 BD 00 00 00 00 00 00 00 00 00 00 00 BE 28
0A0: 00 00 00 00 00 00 00 00 00 00 C1 00 00 00 00 00
0B0: 00 00 00 00 00 00 C2 00 00 00 00 00 00 00 00 00
0C0: 00 00 C3 00 00 00 00 00 00 00 00 00 00 00 C5 00
0D0: 00 00 00 00 00 00 00 00 00 00 C6 00 00 00 00 00
0E0: 00 00 00 00 00 00 C7 00 00 00 00 00 00 00 00 00
0F0: 00 00 F0 00 00 00 00 00 00 00 00 00 00 00 F1 00
100: 00 00 00 00 00 00 00 00 00 00 F2 00 00 00 00 00
110: 00 00 00 00 00 00 00 00 00 00 00 00 00 00 00 00
120: 00 00 00 00 00 00 00 00 00 00 00 00 00 00 00 00
130: 00 00 00 00 00 00 00 00 00 00 00 00 00 00 00 00
140: 00 00 00 00 00 00 00 00 00 00 00 00 00 00 00 00
150: 00 00 00 00 00 00 00 00 00 00 00 00 00 00 00 00
160: 00 00 00 00 00 00 00 00 00 00 00 00 00 00 00 00
170: 00 00 00 00 00 00 00 00 00 00 00 00 00 00 00 00
180: 00 00 00 00 00 00 00 00 00 00 00 00 00 00 00 00
190: 00 00 00 00 00 00 00 00 00 00 00 00 00 00 00 00
1A0: 00 00 00 00 00 00 00 00 00 00 00 00 00 00 00 00
1B0: 00 00 00 00 00 00 00 00 00 00 00 00 00 00 00 00
1C0: 00 00 00 00 00 00 00 00 00 00 00 00 00 00 00 00
1D0: 00 00 00 00 00 00 00 00 00 00 00 00 00 00 00 00
1E0: 00 00 00 00 00 00 00 00 00 00 00 00 00 00 00 00
1F0: 00 00 00 00 00 00 00 00 00 00 00 00 00 00 00 AF

----------------------------------------------------------------------------
 (02) WDC WD20EZAZ-00GGJB0
----------------------------------------------------------------------------
           Model : WDC WD20EZAZ-00GGJB0
        Firmware : 80.00A80
   Serial Number : WD-WXK1A99R5ENH
       Disk Size : 2000.3 GB (8.4/137.4/2000.3/----)
     Buffer Size : Unknown
     Queue Depth : 32
    # of Sectors : 3907029168
   Rotation Rate : 5400 RPM
       Interface : Serial ATA
   Major Version : ACS-3
   Minor Version : ACS-3 Revision 5
   Transfer Mode : SATA/600 | SATA/600
  Power On Hours : 42578 hours
  Power On Count : 24 count
     Temperature : 25 C (77 F)
   Health Status : Good
        Features : S.M.A.R.T., NCQ, TRIM, GPL
       APM Level : ----
       AAM Level : ----
    Drive Letter : D:

-- S.M.A.R.T. --------------------------------------------------------------
ID Cur Wor Thr RawValues(6) Attribute Name
01 200 200 _51 000000000000 Read Error Rate
03 172 172 _21 00000000094F Spin-Up Time
04 100 100 __0 000000000019 Start/Stop Count
05 200 200 140 000000000000 Reallocated Sectors Count
07 200 200 __0 000000000000 Seek Error Rate
09 _42 _42 __0 00000000A652 Power-On Hours
0A 100 253 __0 000000000000 Spin Retry Count
0B 100 253 __0 000000000000 Recalibration Retries
0C 100 100 __0 000000000018 Power Cycle Count
C0 200 200 __0 00000000000C Power-off Retract Count
C1 161 161 __0 00000001CF1A Load/Unload Cycle Count
C2 118 106 __0 000000000019 Temperature
C4 200 200 __0 000000000000 Reallocation Event Count
C5 200 200 __0 000000000000 Current Pending Sector Count
C6 100 253 __0 000000000000 Uncorrectable Sector Count
C7 200 200 __0 000000000000 UltraDMA CRC Error Count
C8 100 253 __0 000000000000 Write Error Rate

-- IDENTIFY_DEVICE ---------------------------------------------------------
        0    1    2    3    4    5    6    7    8    9
000: 427A 3FFF C837 0010 0000 0000 003F 0000 0000 0000
010: 2020 2020 2057 442D 5758 4B31 4139 3952 3545 4E48
020: 0000 0000 0000 3830 2E30 3041 3830 5744 4320 5744
030: 3230 455A 415A 2D30 3047 474A 4230 2020 2020 2020
040: 2020 2020 2020 2020 2020 2020 2020 8010 4000 2F00
050: 4001 0000 0000 0006 3FFF 0010 003F FC10 00FB 0110
060: FFFF 0FFF 0000 0007 0003 0078 0078 0078 0078 0D08
070: 0000 0000 0000 0000 0000 001F 9F0E 0006 004C 004C
080: 07FE 006D 706B 7401 6123 7069 B401 6123 407F 0079
090: 0079 0000 FFFE 0000 0000 0000 0000 0000 0000 0000
100: 88B0 E8E0 0000 0000 0000 000A 6003 0000 5001 4EE2
110: 1220 CD3D 0000 0000 0000 0000 0000 0000 0000 401C
120: 401C 0000 0000 0000 0000 0000 0000 0000 0029 0000
130: 0000 0000 0000 0000 0000 0000 0000 0000 0000 0000
140: 0000 0000 0004 0000 0000 0000 0000 0000 0000 0000
150: 0000 0000 0000 0000 0000 0000 0000 0000 0000 0001
160: 0000 0000 0000 0000 0000 0000 0000 0000 0002 0001
170: 0000 0000 0000 0000 0000 0000 0000 0000 0000 0000
180: 0000 0000 0000 0000 0000 0000 0000 0000 0000 0000
190: 0000 0000 0000 0000 0000 0000 0000 0000 0000 0000
200: 0000 0000 0000 0000 0000 0000 3035 0000 0000 4000
210: 0000 0000 0000 0000 0000 0000 0000 1518 0000 0000
220: 0000 0000 107E 0000 0000 0000 0000 0000 0000 0000
230: 88B0 E8E0 0000 0000 0001 1000 0000 0000 0000 0000
240: 0000 0000 0000 0000 0000 0000 0000 0000 0000 0000
250: 0000 0000 0000 0000 0000 56A5

-- SMART_READ_DATA ---------------------------------------------------------
     +0 +1 +2 +3 +4 +5 +6 +7 +8 +9 +A +B +C +D +E +F
000: 10 00 01 2F 00 C8 C8 00 00 00 00 00 00 00 03 27
010: 00 AC AC 4F 09 00 00 00 00 00 04 32 00 64 64 19
020: 00 00 00 00 00 00 05 33 00 C8 C8 00 00 00 00 00
030: 00 00 07 2E 00 C8 C8 00 00 00 00 00 00 00 09 32
040: 00 2A 2A 52 A6 00 00 00 00 00 0A 32 00 64 FD 00
050: 00 00 00 00 00 00 0B 32 00 64 FD 00 00 00 00 00
060: 00 00 0C 32 00 64 64 18 00 00 00 00 00 00 C0 32
070: 00 C8 C8 0C 00 00 00 00 00 00 C1 32 00 A1 A1 1A
080: CF 01 00 00 00 00 C2 22 00 76 6A 19 00 00 00 00
090: 00 00 C4 32 00 C8 C8 00 00 00 00 00 00 00 C5 32
0A0: 00 C8 C8 00 00 00 00 00 00 00 C6 30 00 64 FD 00
0B0: 00 00 00 00 00 00 C7 32 00 C8 C8 00 00 00 00 00
0C0: 00 00 C8 08 00 64 FD 00 00 00 00 00 00 00 00 00
0D0: 00 00 00 00 00 00 00 00 00 00 00 00 00 00 00 00
0E0: 00 00 00 00 00 00 00 00 00 00 00 00 00 00 00 00
0F0: 00 00 00 00 00 00 00 00 00 00 00 00 00 00 00 00
100: 00 00 00 00 00 00 00 00 00 00 00 00 00 00 00 00
110: 00 00 00 00 00 00 00 00 00 00 00 00 00 00 00 00
120: 00 00 00 00 00 00 00 00 00 00 00 00 00 00 00 00
130: 00 00 00 00 00 00 00 00 00 00 00 00 00 00 00 00
140: 00 00 00 00 00 00 00 00 00 00 00 00 00 00 00 00
150: 00 00 00 00 00 00 00 00 00 00 00 00 00 00 00 00
160: 00 00 00 00 00 00 00 00 00 00 00 00 B4 3C 01 7B
170: 03 00 01 00 02 40 02 00 00 00 00 00 00 00 00 00
180: 00 00 01 02 00 00 00 00 00 00 00 00 00 00 00 00
190: 00 00 00 00 00 00 00 00 00 00 00 00 00 00 00 00
1A0: 00 00 00 00 00 00 00 00 00 00 00 00 00 00 00 00
1B0: 00 00 00 00 00 00 00 00 00 00 00 00 00 00 00 00
1C0: 00 00 00 00 00 00 00 00 00 00 00 00 00 00 00 00
1D0: 00 00 00 00 00 00 00 00 00 00 00 00 00 00 00 00
1E0: 00 00 00 00 00 00 00 00 00 00 00 00 00 00 00 00
1F0: 00 00 00 00 00 00 00 00 00 00 00 00 00 00 00 73

-- SMART_READ_THRESHOLD ----------------------------------------------------
     +0 +1 +2 +3 +4 +5 +6 +7 +8 +9 +A +B +C +D +E +F
000: 10 00 01 33 C8 C8 00 00 00 00 00 00 00 00 03 15
010: 00 00 00 00 00 00 00 00 00 00 04 00 00 00 00 00
020: 00 00 00 00 00 00 05 8C 00 00 00 00 00 00 00 00
030: 00 00 07 00 C8 C8 00 00 00 00 00 00 00 00 09 00
040: 00 00 00 00 00 00 00 00 00 00 0A 00 00 00 00 00
050: 00 00 00 00 00 00 0B 00 00 00 00 00 00 00 00 00
060: 00 00 0C 00 00 00 00 00 00 00 00 00 00 00 C0 00
070: 00 00 00 00 00 00 00 00 00 00 C1 00 00 00 00 00
080: 00 00 00 00 00 00 C2 00 00 00 00 00 00 00 00 00
090: 00 00 C4 00 00 00 00 00 00 00 00 00 00 00 C5 00
0A0: 00 00 00 00 00 00 00 00 00 00 C6 00 00 00 00 00
0B0: 00 00 00 00 00 00 C7 00 00 00 00 00 00 00 00 00
0C0: 00 00 C8 00 00 00 00 00 00 00 00 00 00 00 00 00
0D0: 00 00 00 00 00 00 00 00 00 00 00 00 00 00 00 00
0E0: 00 00 00 00 00 00 00 00 00 00 00 00 00 00 00 00
0F0: 00 00 00 00 00 00 00 00 00 00 00 00 00 00 00 00
100: 00 00 00 00 00 00 00 00 00 00 00 00 00 00 00 00
110: 00 00 00 00 00 00 00 00 00 00 00 00 00 00 00 00
120: 00 00 00 00 00 00 00 00 00 00 00 00 00 00 00 00
130: 00 00 00 00 00 00 00 00 00 00 00 00 00 00 00 00
140: 00 00 00 00 00 00 00 00 00 00 00 00 00 00 00 00
150: 00 00 00 00 00 00 00 00 00 00 00 00 00 00 00 00
160: 00 00 00 00 00 00 00 00 00 00 00 00 B4 3C 01 7B
170: 03 00 01 00 02 40 02 00 00 00 00 00 00 00 00 00
180: 00 00 01 02 00 00 00 00 00 00 00 00 00 00 00 00
190: 00 00 00 00 00 00 00 00 00 00 00 00 00 00 00 00
1A0: 00 00 00 00 00 00 00 00 00 00 00 00 00 00 00 00
1B0: 00 00 00 00 00 00 00 00 00 00 00 00 00 00 00 00
1C0: 00 00 00 00 00 00 00 00 00 00 00 00 00 00 00 00
1D0: 00 00 00 00 00 00 00 00 00 00 00 00 00 00 00 00
1E0: 00 00 00 00 00 00 00 00 00 00 00 00 00 00 00 00
1F0: 00 00 00 00 00 00 00 00 00 00 00 00 00 00 00 E6

----------------------------------------------------------------------------
 (03) WDC WD20EZAZ-00GGJB0
----------------------------------------------------------------------------
           Model : WDC WD20EZAZ-00GGJB0
        Firmware : 80.00A80
   Serial Number : WD-WX11AC967KAZ
       Disk Size : 2000.3 GB (8.4/137.4/2000.3/----)
     Buffer Size : Unknown
     Queue Depth : 32
    # of Sectors : 3907029168
   Rotation Rate : 5400 RPM
       Interface : Serial ATA
   Major Version : ACS-3
   Minor Version : ACS-3 Revision 5
   Transfer Mode : SATA/600 | SATA/600
  Power On Hours : 42572 hours
  Power On Count : 24 count
     Temperature : 23 C (73 F)
   Health Status : Good
        Features : S.M.A.R.T., NCQ, TRIM, GPL
       APM Level : ----
       AAM Level : ----
    Drive Letter : E:

-- S.M.A.R.T. --------------------------------------------------------------
ID Cur Wor Thr RawValues(6) Attribute Name
01 200 200 _51 000000000000 Read Error Rate
03 172 172 _21 000000000936 Spin-Up Time
04 100 100 __0 000000000019 Start/Stop Count
05 200 200 140 000000000000 Reallocated Sectors Count
07 200 200 __0 000000000000 Seek Error Rate
09 _42 _42 __0 00000000A64C Power-On Hours
0A 100 253 __0 000000000000 Spin Retry Count
0B 100 253 __0 000000000000 Recalibration Retries
0C 100 100 __0 000000000018 Power Cycle Count
C0 200 200 __0 00000000000C Power-off Retract Count
C1 192 192 __0 000000006579 Load/Unload Cycle Count
C2 120 106 __0 000000000017 Temperature
C4 200 200 __0 000000000000 Reallocation Event Count
C5 200 200 __0 000000000000 Current Pending Sector Count
C6 100 253 __0 000000000000 Uncorrectable Sector Count
C7 200 200 __0 000000000000 UltraDMA CRC Error Count
C8 100 253 __0 000000000000 Write Error Rate

-- IDENTIFY_DEVICE ---------------------------------------------------------
        0    1    2    3    4    5    6    7    8    9
000: 427A 3FFF C837 0010 0000 0000 003F 0000 0000 0000
010: 2020 2020 2057 442D 5758 3131 4143 3936 374B 415A
020: 0000 0000 0000 3830 2E30 3041 3830 5744 4320 5744
030: 3230 455A 415A 2D30 3047 474A 4230 2020 2020 2020
040: 2020 2020 2020 2020 2020 2020 2020 8010 4000 2F00
050: 4001 0000 0000 0006 3FFF 0010 003F FC10 00FB 0110
060: FFFF 0FFF 0000 0007 0003 0078 0078 0078 0078 0D08
070: 0000 0000 0000 0000 0000 001F 9F0E 0006 004C 004C
080: 07FE 006D 706B 7401 6123 7069 B401 6123 407F 007C
090: 007C 0000 FFFE 0000 0000 0000 0000 0000 0000 0000
100: 88B0 E8E0 0000 0000 0000 000A 6003 0000 5001 4EE2
110: 6776 0EA7 0000 0000 0000 0000 0000 0000 0000 401C
120: 401C 0000 0000 0000 0000 0000 0000 0000 0029 0000
130: 0000 0000 0000 0000 0000 0000 0000 0000 0000 0000
140: 0000 0000 0004 0000 0000 0000 0000 0000 0000 0000
150: 0000 0000 0000 0000 0000 0000 0000 0000 0000 0001
160: 0000 0000 0000 0000 0000 0000 0000 0000 0002 0001
170: 0000 0000 0000 0000 0000 0000 0000 0000 0000 0000
180: 0000 0000 0000 0000 0000 0000 0000 0000 0000 0000
190: 0000 0000 0000 0000 0000 0000 0000 0000 0000 0000
200: 0000 0000 0000 0000 0000 0000 3035 0000 0000 4000
210: 0000 0000 0000 0000 0000 0000 0000 1518 0000 0000
220: 0000 0000 107E 0000 0000 0000 0000 0000 0000 0000
230: 88B0 E8E0 0000 0000 0001 1000 0000 0000 0000 0000
240: 0000 0000 0000 0000 0000 0000 0000 0000 0000 0000
250: 0000 0000 0000 0000 0000 19A5

-- SMART_READ_DATA ---------------------------------------------------------
     +0 +1 +2 +3 +4 +5 +6 +7 +8 +9 +A +B +C +D +E +F
000: 10 00 01 2F 00 C8 C8 00 00 00 00 00 00 00 03 27
010: 00 AC AC 36 09 00 00 00 00 00 04 32 00 64 64 19
020: 00 00 00 00 00 00 05 33 00 C8 C8 00 00 00 00 00
030: 00 00 07 2E 00 C8 C8 00 00 00 00 00 00 00 09 32
040: 00 2A 2A 4C A6 00 00 00 00 00 0A 32 00 64 FD 00
050: 00 00 00 00 00 00 0B 32 00 64 FD 00 00 00 00 00
060: 00 00 0C 32 00 64 64 18 00 00 00 00 00 00 C0 32
070: 00 C8 C8 0C 00 00 00 00 00 00 C1 32 00 C0 C0 79
080: 65 00 00 00 00 00 C2 22 00 78 6A 17 00 00 00 00
090: 00 00 C4 32 00 C8 C8 00 00 00 00 00 00 00 C5 32
0A0: 00 C8 C8 00 00 00 00 00 00 00 C6 30 00 64 FD 00
0B0: 00 00 00 00 00 00 C7 32 00 C8 C8 00 00 00 00 00
0C0: 00 00 C8 08 00 64 FD 00 00 00 00 00 00 00 00 00
0D0: 00 00 00 00 00 00 00 00 00 00 00 00 00 00 00 00
0E0: 00 00 00 00 00 00 00 00 00 00 00 00 00 00 00 00
0F0: 00 00 00 00 00 00 00 00 00 00 00 00 00 00 00 00
100: 00 00 00 00 00 00 00 00 00 00 00 00 00 00 00 00
110: 00 00 00 00 00 00 00 00 00 00 00 00 00 00 00 00
120: 00 00 00 00 00 00 00 00 00 00 00 00 00 00 00 00
130: 00 00 00 00 00 00 00 00 00 00 00 00 00 00 00 00
140: 00 00 00 00 00 00 00 00 00 00 00 00 00 00 00 00
150: 00 00 00 00 00 00 00 00 00 00 00 00 00 00 00 00
160: 00 00 00 00 00 00 00 00 00 00 00 00 54 14 01 7B
170: 03 00 01 00 02 E5 02 00 00 00 00 00 00 00 00 00
180: 00 00 01 02 00 00 00 00 00 00 00 00 00 00 00 00
190: 00 00 00 00 00 00 00 00 00 00 00 00 00 00 00 00
1A0: 00 00 00 00 00 00 00 00 00 00 00 00 00 00 00 00
1B0: 00 00 00 00 00 00 00 00 00 00 00 00 00 00 00 00
1C0: 00 00 00 00 00 00 00 00 00 00 00 00 00 00 00 00
1D0: 00 00 00 00 00 00 00 00 00 00 00 00 00 00 00 00
1E0: 00 00 00 00 00 00 00 00 00 00 00 00 00 00 00 00
1F0: 00 00 00 00 00 00 00 00 00 00 00 00 00 00 00 43

-- SMART_READ_THRESHOLD ----------------------------------------------------
     +0 +1 +2 +3 +4 +5 +6 +7 +8 +9 +A +B +C +D +E +F
000: 10 00 01 33 C8 C8 00 00 00 00 00 00 00 00 03 15
010: 00 00 00 00 00 00 00 00 00 00 04 00 00 00 00 00
020: 00 00 00 00 00 00 05 8C 00 00 00 00 00 00 00 00
030: 00 00 07 00 C8 C8 00 00 00 00 00 00 00 00 09 00
040: 00 00 00 00 00 00 00 00 00 00 0A 00 00 00 00 00
050: 00 00 00 00 00 00 0B 00 00 00 00 00 00 00 00 00
060: 00 00 0C 00 00 00 00 00 00 00 00 00 00 00 C0 00
070: 00 00 00 00 00 00 00 00 00 00 C1 00 00 00 00 00
080: 00 00 00 00 00 00 C2 00 00 00 00 00 00 00 00 00
090: 00 00 C4 00 00 00 00 00 00 00 00 00 00 00 C5 00
0A0: 00 00 00 00 00 00 00 00 00 00 C6 00 00 00 00 00
0B0: 00 00 00 00 00 00 C7 00 00 00 00 00 00 00 00 00
0C0: 00 00 C8 00 00 00 00 00 00 00 00 00 00 00 00 00
0D0: 00 00 00 00 00 00 00 00 00 00 00 00 00 00 00 00
0E0: 00 00 00 00 00 00 00 00 00 00 00 00 00 00 00 00
0F0: 00 00 00 00 00 00 00 00 00 00 00 00 00 00 00 00
100: 00 00 00 00 00 00 00 00 00 00 00 00 00 00 00 00
110: 00 00 00 00 00 00 00 00 00 00 00 00 00 00 00 00
120: 00 00 00 00 00 00 00 00 00 00 00 00 00 00 00 00
130: 00 00 00 00 00 00 00 00 00 00 00 00 00 00 00 00
140: 00 00 00 00 00 00 00 00 00 00 00 00 00 00 00 00
150: 00 00 00 00 00 00 00 00 00 00 00 00 00 00 00 00
160: 00 00 00 00 00 00 00 00 00 00 00 00 54 14 01 7B
170: 03 00 01 00 02 E5 02 00 00 00 00 00 00 00 00 00
180: 00 00 01 02 00 00 00 00 00 00 00 00 00 00 00 00
190: 00 00 00 00 00 00 00 00 00 00 00 00 00 00 00 00
1A0: 00 00 00 00 00 00 00 00 00 00 00 00 00 00 00 00
1B0: 00 00 00 00 00 00 00 00 00 00 00 00 00 00 00 00
1C0: 00 00 00 00 00 00 00 00 00 00 00 00 00 00 00 00
1D0: 00 00 00 00 00 00 00 00 00 00 00 00 00 00 00 00
1E0: 00 00 00 00 00 00 00 00 00 00 00 00 00 00 00 00
1F0: 00 00 00 00 00 00 00 00 00 00 00 00 00 00 00 C9

----------------------------------------------------------------------------
 (04) WDC WD40NMZW-59GX6S1
----------------------------------------------------------------------------
       Enclosure : WD My Passport 25E2 USB Device (V=1058, P=25E2, sa1)
           Model : WDC WD40NMZW-59GX6S1
        Firmware : 01.01A01
   Serial Number : WD-WX31D770Y132
       Disk Size : 4000.7 GB (8.4/137.4/4000.7/4000.7)
     Buffer Size : Unknown
     Queue Depth : 32
    # of Sectors : 7813971625
   Rotation Rate : 5400 RPM
       Interface : USB (Serial ATA)
   Major Version : ACS-3
   Minor Version : ----
   Transfer Mode : SATA/600 | SATA/600
  Power On Hours : 48760 hours
  Power On Count : 22 count
     Temperature : 29 C (84 F)
   Health Status : Good
        Features : S.M.A.R.T., APM, NCQ, TRIM, GPL
       APM Level : 0080h [ON]
       AAM Level : ----
    Drive Letter : X:

-- S.M.A.R.T. --------------------------------------------------------------
ID Cur Wor Thr RawValues(6) Attribute Name
01 200 200 _51 000000000000 Read Error Rate
03 253 253 _21 000000001014 Spin-Up Time
04 _99 _99 __0 0000000006A8 Start/Stop Count
05 200 200 140 000000000000 Reallocated Sectors Count
09 _34 _34 __0 00000000BE78 Power-On Hours
0A 100 100 __0 000000000000 Spin Retry Count
0B 100 253 __0 000000000000 Recalibration Retries
0C 100 100 __0 000000000016 Power Cycle Count
C0 200 200 __0 00000000000A Power-off Retract Count
C1 192 192 __0 0000000062B4 Load/Unload Cycle Count
C2 123 _99 __0 00000000001D Temperature
C5 200 200 __0 000000000000 Current Pending Sector Count
C6 100 253 __0 000000000000 Uncorrectable Sector Count
C7 200 200 __0 000000000000 UltraDMA CRC Error Count
C8 100 253 __0 000000000000 Write Error Rate

-- IDENTIFY_DEVICE ---------------------------------------------------------
        0    1    2    3    4    5    6    7    8    9
000: 427A 3FFF C837 0010 0000 0000 003F 0000 0000 0000
010: 2020 2020 2057 442D 5758 3331 4437 3730 5931 3332
020: 0000 0000 0000 3031 2E30 3141 3031 5744 4320 5744
030: 3430 4E4D 5A57 2D35 3947 5836 5331 2020 2020 2020
040: 2020 2020 2020 2020 2020 2020 2020 8010 4000 2F00
050: 4001 0000 0000 0006 3FFF 0010 003F FC10 00FB 0100
060: FFFF 0FFF 0000 0107 0003 0078 0078 0078 0078 4D10
070: 0000 0000 0000 0000 0000 001F 9D0E 0006 0044 0000
080: 07FE 0000 706B 7469 6123 7069 B449 6123 007F 8156
090: 8001 0080 BBBB 0000 0000 0000 0000 0000 0000 0000
100: BEA9 D1BF 0001 0000 0000 00FF 6003 0000 5001 4EE6
110: 07E8 247F 0000 0000 0000 0000 0000 0000 0000 4018
120: 4018 0000 0000 0000 0000 0000 0000 0000 0021 0000
130: 0000 0000 0000 0000 0000 0000 0000 0000 0000 0000
140: 0000 0000 0004 0000 0000 0000 0000 0000 0000 0000
150: 0000 0000 0000 0000 0000 0000 0000 0000 0000 0001
160: 0000 0000 0000 0000 0000 0000 0000 0000 0003 0001
170: 0000 0000 0000 0000 0000 0000 0000 0000 0000 0000
180: 0000 0000 0000 0000 0000 0000 0000 0000 0000 0000
190: 0000 0000 0000 0000 0000 0000 0000 0000 0000 0000
200: 0000 0000 0000 0000 0000 0000 30B5 0000 0000 4000
210: 0000 0000 0000 0000 0000 0000 0000 1518 0000 0000
220: 0000 0000 107E 0000 0000 0000 0000 0000 0000 0000
230: 0000 0000 0000 0000 0001 2800 0000 0000 0000 0000
240: 0000 0000 0000 0000 0000 0000 0000 0000 0000 0000
250: 0000 0000 0000 0000 0000 79A5

-- SMART_READ_DATA ---------------------------------------------------------
     +0 +1 +2 +3 +4 +5 +6 +7 +8 +9 +A +B +C +D +E +F
000: 10 00 01 2F 00 C8 C8 00 00 00 00 00 00 00 03 27
010: 00 FD FD 14 10 00 00 00 00 00 04 32 00 63 63 A8
020: 06 00 00 00 00 00 05 33 00 C8 C8 00 00 00 00 00
030: 00 00 09 32 00 22 22 78 BE 00 00 00 00 00 0A 32
040: 00 64 64 00 00 00 00 00 00 00 0B 32 00 64 FD 00
050: 00 00 00 00 00 00 0C 32 00 64 64 16 00 00 00 00
060: 00 00 C0 32 00 C8 C8 0A 00 00 00 00 00 00 C1 32
070: 00 C0 C0 B4 62 00 00 00 00 00 C2 22 00 7B 63 1D
080: 00 00 00 00 00 00 C5 32 00 C8 C8 00 00 00 00 00
090: 00 00 C6 30 00 64 FD 00 00 00 00 00 00 00 C7 32
0A0: 00 C8 C8 00 00 00 00 00 00 00 C8 08 00 64 FD 00
0B0: 00 00 00 00 00 00 00 00 00 00 00 00 00 00 00 00
0C0: 00 00 00 00 00 00 00 00 00 00 00 00 00 00 00 00
0D0: 00 00 00 00 00 00 00 00 00 00 00 00 00 00 00 00
0E0: 00 00 00 00 00 00 00 00 00 00 00 00 00 00 00 00
0F0: 00 00 00 00 00 00 00 00 00 00 00 00 00 00 00 00
100: 00 00 00 00 00 00 00 00 00 00 00 00 00 00 00 00
110: 00 00 00 00 00 00 00 00 00 00 00 00 00 00 00 00
120: 00 00 00 00 00 00 00 00 00 00 00 00 00 00 00 00
130: 00 00 00 00 00 00 00 00 00 00 00 00 00 00 00 00
140: 00 00 00 00 00 00 00 00 00 00 00 00 00 00 00 00
150: 00 00 00 00 00 00 00 00 00 00 00 00 00 00 00 00
160: 00 00 00 00 00 00 00 00 00 00 00 00 FC F3 01 1B
170: 03 00 01 00 02 FF 00 8C 01 00 00 00 00 00 00 00
180: 00 00 01 0A 00 00 00 00 00 00 00 00 00 00 00 00
190: 00 00 00 00 00 00 00 00 00 00 00 00 00 00 00 00
1A0: 00 00 00 00 00 00 00 00 00 00 00 00 00 00 00 00
1B0: 00 00 00 00 00 00 00 00 00 00 00 00 00 00 00 00
1C0: 00 00 00 00 00 00 00 00 00 00 00 00 00 00 00 00
1D0: 00 00 00 00 00 00 00 00 00 00 00 00 00 00 00 00
1E0: 00 00 00 00 00 00 00 00 00 00 00 00 00 00 00 00
1F0: 00 00 00 00 00 00 00 00 00 00 00 00 00 00 00 CF

-- SMART_READ_THRESHOLD ----------------------------------------------------
     +0 +1 +2 +3 +4 +5 +6 +7 +8 +9 +A +B +C +D +E +F
000: 10 00 01 33 C8 C8 C8 C8 C8 C8 C8 C8 C8 C8 03 15
010: 00 00 00 00 00 00 00 00 00 00 04 00 00 00 00 00
020: 00 00 00 00 00 00 05 8C 00 00 00 00 00 00 00 00
030: 00 00 09 00 00 00 00 00 00 00 00 00 00 00 0A 00
040: 00 00 00 00 00 00 00 00 00 00 0B 00 00 00 00 00
050: 00 00 00 00 00 00 0C 00 00 00 00 00 00 00 00 00
060: 00 00 C0 00 00 00 00 00 00 00 00 00 00 00 C1 00
070: 00 00 00 00 00 00 00 00 00 00 C2 00 00 00 00 00
080: 00 00 00 00 00 00 C5 00 00 00 00 00 00 00 00 00
090: 00 00 C6 00 00 00 00 00 00 00 00 00 00 00 C7 00
0A0: 00 00 00 00 00 00 00 00 00 00 C8 00 00 00 00 00
0B0: 00 00 00 00 00 00 00 00 00 00 00 00 00 00 00 00
0C0: 00 00 00 00 00 00 00 00 00 00 00 00 00 00 00 00
0D0: 00 00 00 00 00 00 00 00 00 00 00 00 00 00 00 00
0E0: 00 00 00 00 00 00 00 00 00 00 00 00 00 00 00 00
0F0: 00 00 00 00 00 00 00 00 00 00 00 00 00 00 00 00
100: 00 00 00 00 00 00 00 00 00 00 00 00 00 00 00 00
110: 00 00 00 00 00 00 00 00 00 00 00 00 00 00 00 00
120: 00 00 00 00 00 00 00 00 00 00 00 00 00 00 00 00
130: 00 00 00 00 00 00 00 00 00 00 00 00 00 00 00 00
140: 00 00 00 00 00 00 00 00 00 00 00 00 00 00 00 00
150: 00 00 00 00 00 00 00 00 00 00 00 00 00 00 00 00
160: 00 00 00 00 00 00 00 00 00 00 00 00 FC F3 01 1B
170: 03 00 01 00 02 FF 00 8C 01 00 00 00 00 00 00 00
180: 00 00 01 0A 00 00 00 00 00 00 00 00 00 00 00 00
190: 00 00 00 00 00 00 00 00 00 00 00 00 00 00 00 00
1A0: 00 00 00 00 00 00 00 00 00 00 00 00 00 00 00 00
1B0: 00 00 00 00 00 00 00 00 00 00 00 00 00 00 00 00
1C0: 00 00 00 00 00 00 00 00 00 00 00 00 00 00 00 00
1D0: 00 00 00 00 00 00 00 00 00 00 00 00 00 00 00 00
1E0: 00 00 00 00 00 00 00 00 00 00 00 00 00 00 00 00
1F0: 00 00 00 00 00 00 00 00 00 00 00 00 00 00 00 10

----------------------------------------------------------------------------
 (05) WDC WD40NMZW-59GX6S1
----------------------------------------------------------------------------
       Enclosure : WD My Passport 25E2 USB Device (V=1058, P=25E2, sa1)
           Model : WDC WD40NMZW-59GX6S1
        Firmware : 01.01A01
   Serial Number : WD-WX21D77EZDT7
       Disk Size : 4000.7 GB (8.4/137.4/4000.7/4000.7)
     Buffer Size : Unknown
     Queue Depth : 32
    # of Sectors : 7813971625
   Rotation Rate : 5400 RPM
       Interface : USB (Serial ATA)
   Major Version : ACS-3
   Minor Version : ----
   Transfer Mode : SATA/600 | SATA/600
  Power On Hours : 45190 hours
  Power On Count : 23 count
     Temperature : 29 C (84 F)
   Health Status : Good
        Features : S.M.A.R.T., APM, NCQ, TRIM, GPL
       APM Level : 0080h [ON]
       AAM Level : ----
    Drive Letter : Z:

-- S.M.A.R.T. --------------------------------------------------------------
ID Cur Wor Thr RawValues(6) Attribute Name
01 200 200 _51 000000000000 Read Error Rate
03 253 253 _21 000000001313 Spin-Up Time
04 _98 _98 __0 0000000009E1 Start/Stop Count
05 200 200 140 000000000000 Reallocated Sectors Count
09 _39 _39 __0 00000000B086 Power-On Hours
0A 100 100 __0 000000000000 Spin Retry Count
0B 100 253 __0 000000000000 Recalibration Retries
0C 100 100 __0 000000000017 Power Cycle Count
C0 200 200 __0 000000000008 Power-off Retract Count
C1 185 185 __0 00000000B04F Load/Unload Cycle Count
C2 123 100 __0 00000000001D Temperature
C5 200 200 __0 000000000000 Current Pending Sector Count
C6 100 253 __0 000000000000 Uncorrectable Sector Count
C7 200 200 __0 000000000000 UltraDMA CRC Error Count
C8 100 253 __0 000000000000 Write Error Rate

-- IDENTIFY_DEVICE ---------------------------------------------------------
        0    1    2    3    4    5    6    7    8    9
000: 427A 3FFF C837 0010 0000 0000 003F 0000 0000 0000
010: 2020 2020 2057 442D 5758 3231 4437 3745 5A44 5437
020: 0000 0000 0000 3031 2E30 3141 3031 5744 4320 5744
030: 3430 4E4D 5A57 2D35 3947 5836 5331 2020 2020 2020
040: 2020 2020 2020 2020 2020 2020 2020 8010 4000 2F00
050: 4001 0000 0000 0006 3FFF 0010 003F FC10 00FB 0100
060: FFFF 0FFF 0000 0107 0003 0078 0078 0078 0078 4D10
070: 0000 0000 0000 0000 0000 001F 9D0E 0006 0044 0000
080: 07FE 0000 706B 7469 6123 7069 B449 6123 007F 8152
090: 8001 0080 BBBB 0000 0000 0000 0000 0000 0000 0000
100: BEA9 D1BF 0001 0000 0000 00FF 6003 0000 5001 4EE6
110: 07E8 15A9 0000 0000 0000 0000 0000 0000 0000 4018
120: 4018 0000 0000 0000 0000 0000 0000 0000 0021 0000
130: 0000 0000 0000 0000 0000 0000 0000 0000 0000 0000
140: 0000 0000 0004 0000 0000 0000 0000 0000 0000 0000
150: 0000 0000 0000 0000 0000 0000 0000 0000 0000 0001
160: 0000 0000 0000 0000 0000 0000 0000 0000 0003 0001
170: 0000 0000 0000 0000 0000 0000 0000 0000 0000 0000
180: 0000 0000 0000 0000 0000 0000 0000 0000 0000 0000
190: 0000 0000 0000 0000 0000 0000 0000 0000 0000 0000
200: 0000 0000 0000 0000 0000 0000 30B5 0000 0000 4000
210: 0000 0000 0000 0000 0000 0000 0000 1518 0000 0000
220: 0000 0000 107E 0000 0000 0000 0000 0000 0000 0000
230: 0000 0000 0000 0000 0001 2800 0000 0000 0000 0000
240: 0000 0000 0000 0000 0000 0000 0000 0000 0000 0000
250: 0000 0000 0000 0000 0000 14A5

-- SMART_READ_DATA ---------------------------------------------------------
     +0 +1 +2 +3 +4 +5 +6 +7 +8 +9 +A +B +C +D +E +F
000: 10 00 01 2F 00 C8 C8 00 00 00 00 00 00 00 03 27
010: 00 FD FD 13 13 00 00 00 00 00 04 32 00 62 62 E1
020: 09 00 00 00 00 00 05 33 00 C8 C8 00 00 00 00 00
030: 00 00 09 32 00 27 27 86 B0 00 00 00 00 00 0A 32
040: 00 64 64 00 00 00 00 00 00 00 0B 32 00 64 FD 00
050: 00 00 00 00 00 00 0C 32 00 64 64 17 00 00 00 00
060: 00 00 C0 32 00 C8 C8 08 00 00 00 00 00 00 C1 32
070: 00 B9 B9 4F B0 00 00 00 00 00 C2 22 00 7B 64 1D
080: 00 00 00 00 00 00 C5 32 00 C8 C8 00 00 00 00 00
090: 00 00 C6 30 00 64 FD 00 00 00 00 00 00 00 C7 32
0A0: 00 C8 C8 00 00 00 00 00 00 00 C8 08 00 64 FD 00
0B0: 00 00 00 00 00 00 00 00 00 00 00 00 00 00 00 00
0C0: 00 00 00 00 00 00 00 00 00 00 00 00 00 00 00 00
0D0: 00 00 00 00 00 00 00 00 00 00 00 00 00 00 00 00
0E0: 00 00 00 00 00 00 00 00 00 00 00 00 00 00 00 00
0F0: 00 00 00 00 00 00 00 00 00 00 00 00 00 00 00 00
100: 00 00 00 00 00 00 00 00 00 00 00 00 00 00 00 00
110: 00 00 00 00 00 00 00 00 00 00 00 00 00 00 00 00
120: 00 00 00 00 00 00 00 00 00 00 00 00 00 00 00 00
130: 00 00 00 00 00 00 00 00 00 00 00 00 00 00 00 00
140: 00 00 00 00 00 00 00 00 00 00 00 00 00 00 00 00
150: 00 00 00 00 00 00 00 00 00 00 00 00 00 00 00 00
160: 00 00 00 00 00 00 00 00 00 00 00 00 F0 F0 01 1B
170: 03 00 01 00 02 FF 00 8D 01 00 00 00 00 00 00 00
180: 00 00 01 0A 00 00 00 00 00 00 00 00 00 00 00 00
190: 00 00 00 00 00 00 00 00 00 00 00 00 00 00 00 00
1A0: 00 00 00 00 00 00 00 00 00 00 00 00 00 00 00 00
1B0: 00 00 00 00 00 00 00 00 00 00 00 00 00 00 00 00
1C0: 00 00 00 00 00 00 00 00 00 00 00 00 00 00 00 00
1D0: 00 00 00 00 00 00 00 00 00 00 00 00 00 00 00 00
1E0: 00 00 00 00 00 00 00 00 00 00 00 00 00 00 00 00
1F0: 00 00 00 00 00 00 00 00 00 00 00 00 00 00 00 BC

-- SMART_READ_THRESHOLD ----------------------------------------------------
     +0 +1 +2 +3 +4 +5 +6 +7 +8 +9 +A +B +C +D +E +F
000: 10 00 01 33 C8 C8 C8 C8 C8 C8 C8 C8 C8 C8 03 15
010: 00 00 00 00 00 00 00 00 00 00 04 00 00 00 00 00
020: 00 00 00 00 00 00 05 8C 00 00 00 00 00 00 00 00
030: 00 00 09 00 00 00 00 00 00 00 00 00 00 00 0A 00
040: 00 00 00 00 00 00 00 00 00 00 0B 00 00 00 00 00
050: 00 00 00 00 00 00 0C 00 00 00 00 00 00 00 00 00
060: 00 00 C0 00 00 00 00 00 00 00 00 00 00 00 C1 00
070: 00 00 00 00 00 00 00 00 00 00 C2 00 00 00 00 00
080: 00 00 00 00 00 00 C5 00 00 00 00 00 00 00 00 00
090: 00 00 C6 00 00 00 00 00 00 00 00 00 00 00 C7 00
0A0: 00 00 00 00 00 00 00 00 00 00 C8 00 00 00 00 00
0B0: 00 00 00 00 00 00 00 00 00 00 00 00 00 00 00 00
0C0: 00 00 00 00 00 00 00 00 00 00 00 00 00 00 00 00
0D0: 00 00 00 00 00 00 00 00 00 00 00 00 00 00 00 00
0E0: 00 00 00 00 00 00 00 00 00 00 00 00 00 00 00 00
0F0: 00 00 00 00 00 00 00 00 00 00 00 00 00 00 00 00
100: 00 00 00 00 00 00 00 00 00 00 00 00 00 00 00 00
110: 00 00 00 00 00 00 00 00 00 00 00 00 00 00 00 00
120: 00 00 00 00 00 00 00 00 00 00 00 00 00 00 00 00
130: 00 00 00 00 00 00 00 00 00 00 00 00 00 00 00 00
140: 00 00 00 00 00 00 00 00 00 00 00 00 00 00 00 00
150: 00 00 00 00 00 00 00 00 00 00 00 00 00 00 00 00
160: 00 00 00 00 00 00 00 00 00 00 00 00 F0 F0 01 1B
170: 03 00 01 00 02 FF 00 8D 01 00 00 00 00 00 00 00
180: 00 00 01 0A 00 00 00 00 00 00 00 00 00 00 00 00
190: 00 00 00 00 00 00 00 00 00 00 00 00 00 00 00 00
1A0: 00 00 00 00 00 00 00 00 00 00 00 00 00 00 00 00
1B0: 00 00 00 00 00 00 00 00 00 00 00 00 00 00 00 00
1C0: 00 00 00 00 00 00 00 00 00 00 00 00 00 00 00 00
1D0: 00 00 00 00 00 00 00 00 00 00 00 00 00 00 00 00
1E0: 00 00 00 00 00 00 00 00 00 00 00 00 00 00 00 00
1F0: 00 00 00 00 00 00 00 00 00 00 00 00 00 00 00 1E

----------------------------------------------------------------------------
 (06) Samsung SSD 860 EVO 1TB
----------------------------------------------------------------------------
           Model : Samsung SSD 860 EVO 1TB
        Firmware : RVT03B6Q
   Serial Number : S59VNG0MB12888X
       Disk Size : 1000.2 GB (8.4/137.4/1000.2/----)
     Buffer Size : Unknown
     Queue Depth : 32
    # of Sectors : 1953525168
   Rotation Rate : ---- (SSD)
       Interface : Serial ATA
   Major Version : ACS-4
   Minor Version : ACS-4 Revision 5
   Transfer Mode : SATA/600 | SATA/600
  Power On Hours : 42633 hours
  Power On Count : 36 count
     Host Writes : 19 GB
Wear Level Count : 0
     Temperature : 23 C (73 F)
   Health Status : Good (100 %)
        Features : S.M.A.R.T., NCQ, TRIM, DevSleep, GPL
       APM Level : ----
       AAM Level : ----
    Drive Letter : 

-- S.M.A.R.T. --------------------------------------------------------------
ID Cur Wor Thr RawValues(6) Attribute Name
05 100 100 _10 000000000000 Reallocated Sector Count
09 _91 _91 __0 00000000A689 Power-on Hours
0C _99 _99 __0 000000000024 Power-on Count
B1 100 100 __0 000000000000 Wear Leveling Count
B3 100 100 _10 000000000000 Used Reserved Block Count (Total)
B5 100 100 _10 000000000000 Program Fail Count (Total)
B6 100 100 _10 000000000000 Erase Fail Count (Total)
B7 100 100 _10 000000000000 Runtime Bad Block (Total)
BB 100 100 __0 000000000000 Uncorrectable Error Count
BE _77 _66 __0 000000000017 Airflow Temperature
C3 200 200 __0 000000000000 ECC Error Rate
C7 100 100 __0 000000000000 CRC Error Count
EB _99 _99 __0 000000000010 POR Recovery Count
F1 _99 _99 __0 0000026D05BA Total LBAs Written

-- IDENTIFY_DEVICE ---------------------------------------------------------
        0    1    2    3    4    5    6    7    8    9
000: 0040 3FFF C837 0010 0000 0000 003F 0000 0000 0000
010: 5335 3956 4E47 304D 4231 3238 3838 5820 2020 2020
020: 0000 0000 0000 5256 5430 3342 3651 5361 6D73 756E
030: 6720 5353 4420 3836 3020 4556 4F20 3154 4220 2020
040: 2020 2020 2020 2020 2020 2020 2020 8001 4001 2F00
050: 4000 0200 0200 0007 3FFF 0010 003F FC10 00FB 0101
060: FFFF 0FFF 0000 0007 0003 0078 0078 0078 0078 4F30
070: 0000 0000 0000 0000 0000 001F 850E 00C6 016C 006C
080: 09FC 005E 746B 7D01 4163 7469 BC01 4163 407F 0002
090: 0004 0000 FFFE 0000 0000 0000 0000 0000 0000 0000
100: 6DB0 7470 0000 0000 0000 0008 4000 0000 5002 538E
110: 7028 D149 0000 0000 0000 0000 0000 0000 0000 401E
120: 401C 0000 0000 0000 0000 0000 0000 0000 0029 0000
130: 0000 0000 0000 0000 0000 0000 0000 0000 0000 0000
140: 0000 0000 0000 0000 0000 0000 0000 0000 0000 0000
150: 0000 0000 0000 0000 0000 0000 0000 0000 0000 0000
160: 0000 0000 0000 0000 0000 0000 0000 0000 0003 0001
170: 2020 2020 2020 2020 0000 0000 0000 0000 0000 0000
180: 0000 0000 0000 0000 0000 0000 0000 0000 0000 0000
190: 0000 0000 0000 0000 0000 0000 0000 0000 0000 0000
200: 0000 0000 0000 0000 0000 0000 003D 0000 0000 4000
210: 0000 0000 0000 0000 0000 0000 0000 0001 0000 0000
220: 0000 0000 10FF 0000 0000 0000 0000 0000 0000 0000
230: 0000 0000 0000 0000 0000 1400 0000 0000 0000 0000
240: 0000 0000 0000 4000 0000 0000 0000 0000 0000 0000
250: 0000 0000 0000 0000 0000 50A5

-- SMART_READ_DATA ---------------------------------------------------------
     +0 +1 +2 +3 +4 +5 +6 +7 +8 +9 +A +B +C +D +E +F
000: 01 00 05 33 00 64 64 00 00 00 00 00 00 00 09 32
010: 00 5B 5B 89 A6 00 00 00 00 00 0C 32 00 63 63 24
020: 00 00 00 00 00 00 B1 13 00 64 64 00 00 00 00 00
030: 00 00 B3 13 00 64 64 00 00 00 00 00 00 00 B5 32
040: 00 64 64 00 00 00 00 00 00 00 B6 32 00 64 64 00
050: 00 00 00 00 00 00 B7 13 00 64 64 00 00 00 00 00
060: 00 00 BB 32 00 64 64 00 00 00 00 00 00 00 BE 32
070: 00 4D 42 17 00 00 00 00 00 00 C3 1A 00 C8 C8 00
080: 00 00 00 00 00 00 C7 3E 00 64 64 00 00 00 00 00
090: 00 00 EB 12 00 63 63 10 00 00 00 00 00 00 F1 32
0A0: 00 63 63 BA 05 6D 02 00 00 00 00 00 00 00 00 00
0B0: 00 00 00 00 00 00 00 00 00 00 00 00 00 00 00 00
0C0: 00 00 00 00 00 00 00 00 00 00 00 00 00 00 00 00
0D0: 00 00 00 00 00 00 00 00 00 00 00 00 00 00 00 00
0E0: 00 00 00 00 00 00 00 00 00 00 00 00 00 00 00 00
0F0: 00 00 00 00 00 00 00 00 00 00 00 00 00 00 00 00
100: 00 00 00 00 00 00 00 00 00 00 00 00 00 00 00 00
110: 00 00 00 00 00 00 00 00 00 00 00 00 00 00 00 00
120: 00 00 00 00 00 00 00 00 00 00 00 00 00 00 00 00
130: 00 00 00 00 00 00 00 00 00 00 00 00 00 00 00 00
140: 00 00 00 00 00 00 00 00 00 00 00 00 00 00 00 00
150: 00 00 00 00 00 00 00 00 00 00 00 00 00 00 00 00
160: 00 00 00 00 00 00 00 00 00 00 00 00 00 00 00 53
170: 03 00 01 00 02 55 00 00 00 00 00 00 00 00 00 00
180: 00 00 00 00 00 00 00 00 00 00 00 00 00 00 00 00
190: 00 00 00 00 00 00 00 00 00 00 00 00 00 00 00 00
1A0: 00 00 00 00 00 00 00 00 00 00 00 00 00 00 00 00
1B0: 00 00 00 00 00 00 00 00 00 00 00 00 00 00 00 00
1C0: 00 00 00 00 00 00 00 00 00 00 00 00 00 00 00 00
1D0: 00 00 00 00 00 00 00 00 00 00 00 00 00 00 00 00
1E0: 00 00 00 00 00 00 00 00 00 00 00 00 00 00 00 00
1F0: 00 00 00 00 00 00 00 00 00 00 00 00 00 00 00 8F

-- SMART_READ_THRESHOLD ----------------------------------------------------
     +0 +1 +2 +3 +4 +5 +6 +7 +8 +9 +A +B +C +D +E +F
000: 01 00 05 0A 00 00 00 00 00 00 00 00 00 00 09 00
010: 00 00 00 00 00 00 00 00 00 00 0C 00 00 00 00 00
020: 00 00 00 00 00 00 B1 00 00 00 00 00 00 00 00 00
030: 00 00 B3 0A 00 00 00 00 00 00 00 00 00 00 B5 0A
040: 00 00 00 00 00 00 00 00 00 00 B6 0A 00 00 00 00
050: 00 00 00 00 00 00 B7 0A 00 00 00 00 00 00 00 00
060: 00 00 BB 00 00 00 00 00 00 00 00 00 00 00 BE 00
070: 00 00 00 00 00 00 00 00 00 00 C3 00 00 00 00 00
080: 00 00 00 00 00 00 C7 00 00 00 00 00 00 00 00 00
090: 00 00 EB 00 00 00 00 00 00 00 00 00 00 00 F1 00
0A0: 00 00 00 00 00 00 00 00 00 00 00 00 00 00 00 00
0B0: 00 00 00 00 00 00 00 00 00 00 00 00 00 00 00 00
0C0: 00 00 00 00 00 00 00 00 00 00 00 00 00 00 00 00
0D0: 00 00 00 00 00 00 00 00 00 00 00 00 00 00 00 00
0E0: 00 00 00 00 00 00 00 00 00 00 00 00 00 00 00 00
0F0: 00 00 00 00 00 00 00 00 00 00 00 00 00 00 00 00
100: 00 00 00 00 00 00 00 00 00 00 00 00 00 00 00 00
110: 00 00 00 00 00 00 00 00 00 00 00 00 00 00 00 00
120: 00 00 00 00 00 00 00 00 00 00 00 00 00 00 00 00
130: 00 00 00 00 00 00 00 00 00 00 00 00 00 00 00 00
140: 00 00 00 00 00 00 00 00 00 00 00 00 00 00 00 00
150: 00 00 00 00 00 00 00 00 00 00 00 00 00 00 00 00
160: 00 00 00 00 00 00 00 00 00 00 00 00 00 00 00 00
170: 00 00 00 00 00 00 00 00 00 00 00 00 00 00 00 00
180: 00 00 00 00 00 00 00 00 00 00 00 00 00 00 00 00
190: 00 00 00 00 00 00 00 00 00 00 00 00 00 00 00 00
1A0: 00 00 00 00 00 00 00 00 00 00 00 00 00 00 00 00
1B0: 00 00 00 00 00 00 00 00 00 00 00 00 00 00 00 00
1C0: 00 00 00 00 00 00 00 00 00 00 00 00 00 00 00 00
1D0: 00 00 00 00 00 00 00 00 00 00 00 00 00 00 00 00
1E0: 00 00 00 00 00 00 00 00 00 00 00 00 00 00 00 00
1F0: 00 00 00 00 00 00 00 00 00 00 00 00 00 00 00 4E

