----------------------------------------------------------------------------
CrystalDiskInfo 9.6.3 (C) 2008-2024 hiyohiyo
                                Crystal Dew World: https://crystalmark.info/
----------------------------------------------------------------------------

    OS : Windows 11 Pro 23H2 [10.0 Build 22631] (x64)
  Date : 2025/04/13 0:13:07

-- Controller Map ----------------------------------------------------------
 - Standard SATA AHCI Controller [ATA]
 - Microsoft Storage Spaces Controller [SCSI]
 + Standard NVM Express Controller [SCSI]
   - CT1000P3PSSD8

-- Disk List ---------------------------------------------------------------
 (01) CT1000P3PSSD8 : 1000.2 GB [0/1/0, sq] - nv
 (02) WDC WD20NMVW-11EDZS7 : 2000.3 GB [1/0/0, sa1]

----------------------------------------------------------------------------
 (01) CT1000P3PSSD8
----------------------------------------------------------------------------
           Model : CT1000P3PSSD8
        Firmware : P9CR413
   Serial Number : 240646CF7678
       Disk Size : 1000.2 GB
       Interface : NVM Express
        Standard : NVM Express 1.4
   Transfer Mode : PCIe 3.0 x4 | PCIe 4.0 x4
  Power On Hours : 4653 hours
  Power On Count : 4 count
      Host Reads : 2636 GB
     Host Writes : 7041 GB
     Temperature : 41 C (105 F)
   Health Status : Good (98 %)
        Features : S.M.A.R.T., TRIM, VolatileWriteCache
    Drive Letter : C:

-- S.M.A.R.T. --------------------------------------------------------------
ID RawValues(6) Attribute Name
01 000000000000 Critical Warning
02 00000000013A Composite Temperature
03 000000000064 Available Spare
04 000000000005 Available Spare Threshold
05 000000000002 Percentage Used
06 0000005461B4 Data Units Read
07 000000E150C5 Data Units Written
08 00000364CE62 Host Read Commands
09 000014DE4FC6 Host Write Commands
0A 000000000054 Controller Busy Time
0B 000000000004 Power Cycles
0C 00000000122D Power On Hours
0D 000000000000 Unsafe Shutdowns
0E 000000000000 Media and Data Integrity Errors
0F 000000000000 Number of Error Information Log Entries

-- IDENTIFY_DEVICE ---------------------------------------------------------
        0    1    2    3    4    5    6    7    8    9
000: 1344 1344 3432 3630 3634 4643 3637 3837 2020 2020
010: 2020 2020 5443 3031 3030 3350 5350 4453 2038 2020
020: 2020 2020 2020 2020 2020 2020 2020 2020 2020 2020
030: 2020 2020 3950 5243 3134 2033 7506 00A0 0600 0000
040: 0400 0001 A120 0007 4B40 004C 0200 0000 0002 0000
050: 0000 0000 0000 0000 0000 0100 0000 0000 0000 0000
060: 0000 0000 0000 0000 0000 0000 0000 0000 0000 0000
070: 0000 0000 0000 0000 0000 0000 0000 0000 0000 0000
080: 0000 0000 0000 0000 0000 0000 0000 0000 0000 0000
090: 0000 0000 0000 0000 0000 0000 0000 0000 0000 0000
100: 0000 0000 0000 0000 0000 0000 0000 0000 0000 0000
110: 0000 0000 0000 0000 0000 0000 0000 0000 0000 0000
120: 0000 0000 0000 0000 0000 0000 0000 0000 0017 0703
130: 1E14 04FE 0101 0164 0166 0032 4000 0000 4000 0000
140: 0000 0000 0000 0000 0000 0000 0000 0000 0000 0000
150: 0000 0000 0000 0000 0000 0000 0000 0000 000A 0401
160: 0000 0001 0111 0164 0002 A000 0400 0000 0010 0000
170: 0000 0000 0000 0000 0000 0000 0060 0000 0000 0000
180: 0000 0000 0000 0000 0000 0000 0000 0000 0000 0000
190: 0000 0000 0000 0000 0000 0000 0000 0000 0000 0000
200: 0000 0000 0000 0000 0000 0000 0000 0000 0000 0000
210: 0000 0000 0000 0000 0000 0000 0000 0000 0000 0000
220: 0000 0000 0000 0000 0000 0000 0000 0000 0000 0000
230: 0000 0000 0000 0000 0000 0000 0000 0000 0000 0000
240: 0000 0000 0000 0000 0000 0000 0000 0000 0000 0000
250: 0000 0000 0000 0000 0000 0000

-- SMART_NVME --------------------------------------------------------------
     +0 +1 +2 +3 +4 +5 +6 +7 +8 +9 +A +B +C +D +E +F
000: 00 3A 01 64 05 02 00 00 00 00 00 00 00 00 00 00
010: 00 00 00 00 00 00 00 00 00 00 00 00 00 00 00 00
020: B4 61 54 00 00 00 00 00 00 00 00 00 00 00 00 00
030: C5 50 E1 00 00 00 00 00 00 00 00 00 00 00 00 00
040: 62 CE 64 03 00 00 00 00 00 00 00 00 00 00 00 00
050: C6 4F DE 14 00 00 00 00 00 00 00 00 00 00 00 00
060: 54 00 00 00 00 00 00 00 00 00 00 00 00 00 00 00
070: 04 00 00 00 00 00 00 00 00 00 00 00 00 00 00 00
080: 2D 12 00 00 00 00 00 00 00 00 00 00 00 00 00 00
090: 00 00 00 00 00 00 00 00 00 00 00 00 00 00 00 00
0A0: 00 00 00 00 00 00 00 00 00 00 00 00 00 00 00 00
0B0: 00 00 00 00 00 00 00 00 00 00 00 00 00 00 00 00
0C0: 00 00 00 00 00 00 00 00 3A 01 00 00 00 00 00 00
0D0: 00 00 00 00 00 00 00 00 00 00 00 00 00 00 00 00
0E0: 00 00 00 00 00 00 00 00 00 00 00 00 00 00 00 00
0F0: 00 00 00 00 00 00 00 00 00 00 00 00 00 00 00 00
100: 00 00 00 00 00 00 00 00 00 00 00 00 00 00 00 00
110: 00 00 00 00 00 00 00 00 00 00 00 00 00 00 00 00
120: 00 00 00 00 00 00 00 00 00 00 00 00 00 00 00 00
130: 00 00 00 00 00 00 00 00 00 00 00 00 00 00 00 00
140: 00 00 00 00 00 00 00 00 00 00 00 00 00 00 00 00
150: 00 00 00 00 00 00 00 00 00 00 00 00 00 00 00 00
160: 00 00 00 00 00 00 00 00 00 00 00 00 00 00 00 00
170: 00 00 00 00 00 00 00 00 00 00 00 00 00 00 00 00
180: 00 00 00 00 00 00 00 00 00 00 00 00 00 00 00 00
190: 00 00 00 00 00 00 00 00 00 00 00 00 00 00 00 00
1A0: 00 00 00 00 00 00 00 00 00 00 00 00 00 00 00 00
1B0: 00 00 00 00 00 00 00 00 00 00 00 00 00 00 00 00
1C0: 00 00 00 00 00 00 00 00 00 00 00 00 00 00 00 00
1D0: 00 00 00 00 00 00 00 00 00 00 00 00 00 00 00 00
1E0: 00 00 00 00 00 00 00 00 00 00 00 00 00 00 00 00
1F0: 00 00 00 00 00 00 00 00 00 00 00 00 00 00 00 00

----------------------------------------------------------------------------
 (02) WDC WD20NMVW-11EDZS7
----------------------------------------------------------------------------
       Enclosure : WD Elements 25A1 USB Device (V=1058, P=25A1, sa1)
           Model : WDC WD20NMVW-11EDZS7
        Firmware : 01.01A01
   Serial Number : WD-WXU1A373C32S
       Disk Size : 2000.3 GB (8.4/137.4/2000.3/2000.3)
     Buffer Size : 8192 KB
     Queue Depth : 32
    # of Sectors : 3907029168
   Rotation Rate : 5200 RPM
       Interface : USB (Serial ATA)
   Major Version : ACS-2
   Minor Version : ----
   Transfer Mode : SATA/300 | SATA/300
  Power On Hours : 20001 hours
  Power On Count : 3103 count
     Temperature : 32 C (89 F)
   Health Status : Good
        Features : S.M.A.R.T., APM, NCQ, GPL
       APM Level : 0080h [ON]
       AAM Level : ----
    Drive Letter : D:

-- S.M.A.R.T. --------------------------------------------------------------
ID Cur Wor Thr RawValues(6) Attribute Name
01 200 200 _51 000000000000 Read Error Rate
03 211 205 _21 000000001151 Spin-Up Time
04 _97 _97 __0 000000000D7C Start/Stop Count
05 200 200 140 000000000000 Reallocated Sectors Count
07 200 200 __0 000000000000 Seek Error Rate
09 _73 _73 __0 000000004E21 Power-On Hours
0A 100 100 __0 000000000000 Spin Retry Count
0B 100 100 __0 000000000000 Recalibration Retries
0C _97 _97 __0 000000000C1F Power Cycle Count
C0 200 200 __0 000000000018 Power-off Retract Count
C1 __1 __1 __0 0000001724B1 Load/Unload Cycle Count
C2 120 _98 __0 000000000020 Temperature
C4 200 200 __0 000000000000 Reallocation Event Count
C5 200 200 __0 000000000000 Current Pending Sector Count
C6 100 253 __0 000000000000 Uncorrectable Sector Count
C7 200 200 __0 000000000000 UltraDMA CRC Error Count
C8 100 253 __0 000000000000 Write Error Rate

-- IDENTIFY_DEVICE ---------------------------------------------------------
        0    1    2    3    4    5    6    7    8    9
000: 427A 3FFF C837 0010 0000 0000 003F 0000 0000 0000
010: 2020 2020 2057 442D 5758 5531 4133 3733 4333 3253
020: 0000 4000 0000 3031 2E30 3141 3031 5744 4320 5744
030: 3230 4E4D 5657 2D31 3145 445A 5337 2020 2020 2020
040: 2020 2020 2020 2020 2020 2020 2020 8010 4000 2F00
050: 4001 0000 0000 0007 3FFF 0010 003F FC10 00FB 0100
060: FFFF 0FFF 0000 0107 0003 0078 0078 0078 0078 0000
070: 0000 0000 0000 0000 0000 001F 9F06 0004 004C 0000
080: 03FE 0000 706B 7C69 6123 7069 BC49 6123 007F 00C5
090: 00C5 0080 FFFE 0000 0000 0000 0000 0000 0000 0000
100: 88B0 E8E0 0000 0000 0000 0000 6003 0000 5001 4EE2
110: 0E99 EB09 0000 0000 0000 0000 0000 0000 0000 4018
120: 4018 0000 0000 0000 0000 0000 0000 0000 0021 0000
130: 0000 0000 0000 0000 0000 0000 0000 0000 0000 0000
140: 0000 0000 0004 0000 0000 0000 0000 0000 0000 0000
150: 0000 0000 0000 0000 0000 0000 0000 0000 0000 0000
160: 0000 0000 0000 0000 0000 0000 0000 0000 0000 0000
170: 0000 0000 0000 0000 0000 0000 0000 0000 0000 0000
180: 0000 0000 0000 0000 0000 0000 0000 0000 0000 0000
190: 0000 0000 0000 0000 0000 0000 0000 0000 0000 0000
200: 0000 0000 0000 0000 0000 0000 7035 0000 0000 4000
210: 0000 0000 0000 0000 0000 0000 0000 1450 0000 0000
220: 0000 0000 103E 0000 0000 0000 0000 0000 0000 0000
230: 0000 0000 0000 0000 0001 1000 0000 0000 0000 0000
240: 0000 0000 0000 0000 0000 0000 0000 0000 0000 0000
250: 0000 0000 0000 0000 0000 FCA5

-- SMART_READ_DATA ---------------------------------------------------------
     +0 +1 +2 +3 +4 +5 +6 +7 +8 +9 +A +B +C +D +E +F
000: 10 00 01 2F 00 C8 C8 00 00 00 00 00 00 00 03 27
010: 00 D3 CD 51 11 00 00 00 00 00 04 32 00 61 61 7C
020: 0D 00 00 00 00 00 05 33 00 C8 C8 00 00 00 00 00
030: 00 00 07 2E 00 C8 C8 00 00 00 00 00 00 00 09 32
040: 00 49 49 21 4E 00 00 00 00 00 0A 32 00 64 64 00
050: 00 00 00 00 00 00 0B 32 00 64 64 00 00 00 00 00
060: 00 00 0C 32 00 61 61 1F 0C 00 00 00 00 00 C0 32
070: 00 C8 C8 18 00 00 00 00 00 00 C1 32 00 01 01 B1
080: 24 17 00 00 00 00 C2 22 00 78 62 20 00 00 00 00
090: 00 00 C4 32 00 C8 C8 00 00 00 00 00 00 00 C5 32
0A0: 00 C8 C8 00 00 00 00 00 00 00 C6 30 00 64 FD 00
0B0: 00 00 00 00 00 00 C7 32 00 C8 C8 00 00 00 00 00
0C0: 00 00 C8 08 00 64 FD 00 00 00 00 00 00 00 00 00
0D0: 00 00 00 00 00 00 00 00 00 00 00 00 00 00 00 00
0E0: 00 00 00 00 00 00 00 00 00 00 00 00 00 00 00 00
0F0: 00 00 00 00 00 00 00 00 00 00 00 00 00 00 00 00
100: 00 00 00 00 00 00 00 00 00 00 00 00 00 00 00 00
110: 00 00 00 00 00 00 00 00 00 00 00 00 00 00 00 00
120: 00 00 00 00 00 00 00 00 00 00 00 00 00 00 00 00
130: 00 00 00 00 00 00 00 00 00 00 00 00 00 00 00 00
140: 00 00 00 00 00 00 00 00 00 00 00 00 00 00 00 00
150: 00 00 00 00 00 00 00 00 00 00 00 00 00 00 00 00
160: 00 00 00 00 00 00 00 00 00 00 00 00 9C 90 01 7B
170: 03 00 01 00 02 FF 05 99 01 00 00 00 00 00 00 00
180: 00 00 01 08 00 00 00 00 00 00 00 00 00 00 00 00
190: 00 00 00 00 00 00 00 00 00 00 00 00 00 00 00 00
1A0: 00 00 00 00 00 00 00 00 00 00 00 00 00 00 00 00
1B0: 00 00 00 00 00 00 00 00 00 00 00 00 00 00 00 00
1C0: 00 00 00 00 00 00 00 00 00 00 00 00 00 00 00 00
1D0: 00 00 00 00 00 00 00 00 00 00 00 00 00 00 00 00
1E0: 00 00 00 00 00 00 00 00 00 00 00 00 00 00 00 00
1F0: 00 00 00 00 00 00 00 00 00 00 00 00 00 00 00 BA

-- SMART_READ_THRESHOLD ----------------------------------------------------
     +0 +1 +2 +3 +4 +5 +6 +7 +8 +9 +A +B +C +D +E +F
000: 10 00 01 33 C8 C8 C8 C8 C8 C8 C8 C8 00 00 03 15
010: 00 00 00 00 00 00 00 00 00 00 04 00 00 00 00 00
020: 00 00 00 00 00 00 05 8C 00 00 00 00 00 00 00 00
030: 00 00 07 00 C8 C8 C8 C8 C8 C8 C8 C8 00 00 09 00
040: 00 00 00 00 00 00 00 00 00 00 0A 00 00 00 00 00
050: 00 00 00 00 00 00 0B 00 00 00 00 00 00 00 00 00
060: 00 00 0C 00 00 00 00 00 00 00 00 00 00 00 C0 00
070: 00 00 00 00 00 00 00 00 00 00 C1 00 00 00 00 00
080: 00 00 00 00 00 00 C2 00 00 00 00 00 00 00 00 00
090: 00 00 C4 00 00 00 00 00 00 00 00 00 00 00 C5 00
0A0: 00 00 00 00 00 00 00 00 00 00 C6 00 00 00 00 00
0B0: 00 00 00 00 00 00 C7 00 00 00 00 00 00 00 00 00
0C0: 00 00 C8 00 00 00 00 00 00 00 00 00 00 00 00 00
0D0: 00 00 00 00 00 00 00 00 00 00 00 00 00 00 00 00
0E0: 00 00 00 00 00 00 00 00 00 00 00 00 00 00 00 00
0F0: 00 00 00 00 00 00 00 00 00 00 00 00 00 00 00 00
100: 00 00 00 00 00 00 00 00 00 00 00 00 00 00 00 00
110: 00 00 00 00 00 00 00 00 00 00 00 00 00 00 00 00
120: 00 00 00 00 00 00 00 00 00 00 00 00 00 00 00 00
130: 00 00 00 00 00 00 00 00 00 00 00 00 00 00 00 00
140: 00 00 00 00 00 00 00 00 00 00 00 00 00 00 00 00
150: 00 00 00 00 00 00 00 00 00 00 00 00 00 00 00 00
160: 00 00 00 00 00 00 00 00 00 00 00 00 00 00 00 00
170: 00 00 00 00 00 00 00 00 00 00 00 00 00 00 00 00
180: 00 00 00 00 00 00 00 00 00 00 00 00 00 00 00 00
190: 00 00 00 00 00 00 00 00 00 00 00 00 00 00 00 00
1A0: 00 00 00 00 00 00 00 00 00 00 00 00 00 00 00 00
1B0: 00 00 00 00 00 00 00 00 00 00 00 00 00 00 00 00
1C0: 00 00 00 00 00 00 00 00 00 00 00 00 00 00 00 00
1D0: 00 00 00 00 00 00 00 00 00 00 00 00 00 00 00 00
1E0: 00 00 00 00 00 00 00 00 00 00 00 00 00 00 00 00
1F0: 00 00 00 00 00 00 00 00 00 00 00 00 00 00 00 3D

